{
  "schema_id": "crossframe.promax.v8.source-manifest",
  "schema_version": 1,
  "framework_version": "v8.0",
  "snapshot_sha256": "3186805a3e46e1b16948a4e51d08e7693a8e0dd04aa6b4604e796266d649936c",
  "paragraph_count": 3863,
  "non_whitespace_chars": 155721,
  "table_count": 117,
  "section_count": 16,
  "generator": {
    "version": "1.0.0",
    "sha256": "0b72197a7560c26a877bb803ecdb5d6e50b2e280c98a215b152eaf231c3651c8"
  },
  "source_ranges": [
    {
      "file": "00-source-envelope.md",
      "paragraph_start": "V8-P0001",
      "paragraph_end": "V8-P0333",
      "table_start": "V8-T001",
      "table_end": "V8-T001"
    },
    {
      "file": "01-guide.md",
      "paragraph_start": "V8-P0334",
      "paragraph_end": "V8-P0407",
      "table_start": "V8-T002",
      "table_end": "V8-T003"
    },
    {
      "file": "02-boundary-method.md",
      "paragraph_start": "V8-P0408",
      "paragraph_end": "V8-P0485",
      "table_start": "V8-T004",
      "table_end": "V8-T004"
    },
    {
      "file": "03-universal-grammar.md",
      "paragraph_start": "V8-P0486",
      "paragraph_end": "V8-P0543",
      "table_start": null,
      "table_end": null
    },
    {
      "file": "04-root-assumptions.md",
      "paragraph_start": "V8-P0544",
      "paragraph_end": "V8-P0806",
      "table_start": "V8-T005",
      "table_end": "V8-T010"
    },
    {
      "file": "05-scale-transformation.md",
      "paragraph_start": "V8-P0807",
      "paragraph_end": "V8-P0995",
      "table_start": "V8-T011",
      "table_end": "V8-T014"
    },
    {
      "file": "06-operation-evolution.md",
      "paragraph_start": "V8-P0996",
      "paragraph_end": "V8-P1072",
      "table_start": "V8-T015",
      "table_end": "V8-T015"
    },
    {
      "file": "07-human-world.md",
      "paragraph_start": "V8-P1073",
      "paragraph_end": "V8-P2243",
      "table_start": "V8-T016",
      "table_end": "V8-T073"
    },
    {
      "file": "08-human-state-prototype.md",
      "paragraph_start": "V8-P2244",
      "paragraph_end": "V8-P2526",
      "table_start": "V8-T074",
      "table_end": "V8-T083"
    },
    {
      "file": "09-actor-state-personality.md",
      "paragraph_start": "V8-P2527",
      "paragraph_end": "V8-P2715",
      "table_start": "V8-T084",
      "table_end": "V8-T089"
    },
    {
      "file": "10-multicircle-joint-state.md",
      "paragraph_start": "V8-P2716",
      "paragraph_end": "V8-P2906",
      "table_start": "V8-T090",
      "table_end": "V8-T095"
    },
    {
      "file": "11-event-dynamic-deduction.md",
      "paragraph_start": "V8-P2907",
      "paragraph_end": "V8-P3095",
      "table_start": "V8-T096",
      "table_end": "V8-T101"
    },
    {
      "file": "12-conditional-forecast-choice.md",
      "paragraph_start": "V8-P3096",
      "paragraph_end": "V8-P3306",
      "table_start": "V8-T102",
      "table_end": "V8-T109"
    },
    {
      "file": "13-interface-tools.md",
      "paragraph_start": "V8-P3307",
      "paragraph_end": "V8-P3558",
      "table_start": "V8-T110",
      "table_end": "V8-T117"
    },
    {
      "file": "14-normative-selection.md",
      "paragraph_start": "V8-P3559",
      "paragraph_end": "V8-P3625",
      "table_start": null,
      "table_end": null
    },
    {
      "file": "15-intervention-applications.md",
      "paragraph_start": "V8-P3626",
      "paragraph_end": "V8-P3734",
      "table_start": null,
      "table_end": null
    },
    {
      "file": "16-governance.md",
      "paragraph_start": "V8-P3735",
      "paragraph_end": "V8-P3863",
      "table_start": null,
      "table_end": null
    }
  ],
  "files": [
    {
      "path": "v8-full-source/00-heading-index.md",
      "sha256": "aadff065a4f0c1b61fca9da532c81c76cc5a2af47beff6e866398446496fdc25",
      "size": 259812
    },
    {
      "path": "v8-full-source/00-index.md",
      "sha256": "6cb99f1742270400fc93030b45ca7d4c9cf53ea0dab90aa2d4e3905c4107e5b7",
      "size": 3491
    },
    {
      "path": "v8-full-source/00-source-envelope.md",
      "sha256": "903afe04a999430e988dab808c12b33d030e951346710171312b7fe8dad13709",
      "size": 61963
    },
    {
      "path": "v8-full-source/00-table-index.md",
      "sha256": "d911ef31970bc6d7bfabda85faee5a0a4538d7747316494dd93a1f55cc18b68b",
      "size": 8077
    },
    {
      "path": "v8-full-source/00-term-index.md",
      "sha256": "72e960537bfd0e22fa1b2f5fab890f072da603a7aaa28b2ecd2f7ded993233ff",
      "size": 203071
    },
    {
      "path": "v8-full-source/01-guide.md",
      "sha256": "e85d7c240da20d3a96290c19390da01582e26541db4a02dffad57ec005dadcfc",
      "size": 23032
    },
    {
      "path": "v8-full-source/02-boundary-method.md",
      "sha256": "5f7f4b81ca2f8ce8c112c30f66fc65a95fb5a51b1b849283e5000baa9fcc0822",
      "size": 37515
    },
    {
      "path": "v8-full-source/03-universal-grammar.md",
      "sha256": "701cc177498dd0ceb2327c76ae3a6f34e110d5596fc0154af3eea99beb933a75",
      "size": 30890
    },
    {
      "path": "v8-full-source/04-root-assumptions.md",
      "sha256": "8e440c57c18117e960bb9586a676bc65c349e781d412c85dee2698904cbe3588",
      "size": 113905
    },
    {
      "path": "v8-full-source/05-scale-transformation.md",
      "sha256": "9809269f7d1b28404c54bb76c33bb941453201a406ae681fc884f703d36678dc",
      "size": 75593
    },
    {
      "path": "v8-full-source/06-operation-evolution.md",
      "sha256": "b46d9f916a9f576eb674e9066446305eb017fe593d5f15972b6be2cdddfa9731",
      "size": 35443
    },
    {
      "path": "v8-full-source/07-human-world.md",
      "sha256": "9c69bf28a5e836c4dda22f7e74ee53cfe257382018292c964069a06e132c3a7d",
      "size": 317625
    },
    {
      "path": "v8-full-source/08-human-state-prototype.md",
      "sha256": "99132752fdb3cd61c5f2883ca37888cda2c3fde46622160dd4c83a7a42386ec1",
      "size": 88059
    },
    {
      "path": "v8-full-source/09-actor-state-personality.md",
      "sha256": "728864af38bac0924d2ddd796c62c674dae8430b30508dde897f562a419771f2",
      "size": 49221
    },
    {
      "path": "v8-full-source/10-multicircle-joint-state.md",
      "sha256": "24fe6741ca85195254a4cd6d29efe5823411f2a6c3b4c89c326622a50a038cb5",
      "size": 50847
    },
    {
      "path": "v8-full-source/11-event-dynamic-deduction.md",
      "sha256": "6473dd73e1cd7963bc3eb13e24b82b8bbf8a7f4f7a5caacdb8584213a68280d0",
      "size": 47503
    },
    {
      "path": "v8-full-source/12-conditional-forecast-choice.md",
      "sha256": "d10cb137d4550ec6decffd0bb0f2eb3e1744d828daf0aae3938b7ab2bba74ee8",
      "size": 53967
    },
    {
      "path": "v8-full-source/13-interface-tools.md",
      "sha256": "5ddafdfc722d6bee9f50de1adb6999d6b2f325d058fa11f3fa4c7add89c6dcd5",
      "size": 57657
    },
    {
      "path": "v8-full-source/14-normative-selection.md",
      "sha256": "7ab7d5d099ff6b205ce1db5cb7d58f9c94bf08298872502bdf5feaf5bcc36c4b",
      "size": 44495
    },
    {
      "path": "v8-full-source/15-intervention-applications.md",
      "sha256": "361fb4cc5a2ad5da237bc1eafffba01a6f637cdd9b5f4b0a7897b43392dcd36f",
      "size": 74159
    },
    {
      "path": "v8-full-source/16-governance.md",
      "sha256": "3f7b7344ec6a8ad94abbac2647ac0a71cbc418426c0afadb7f4dc797b155d8a6",
      "size": 65535
    },
    {
      "path": "v8-full-source/tables/V8-T001.md",
      "sha256": "d15deefb5e056f90217a159a3f5299696a368f7a6281b4424f84dcfb786ba2f0",
      "size": 3519
    },
    {
      "path": "v8-full-source/tables/V8-T002.md",
      "sha256": "af15ad5a42fb8931cf48b2846cc0fb84352d655656e8cadc316bc5d53aa8a7b6",
      "size": 3395
    },
    {
      "path": "v8-full-source/tables/V8-T003.md",
      "sha256": "2f5a66e22bc99cfb99357e7bac82741a08f470ae755e2d47d1eb67f01ca5461e",
      "size": 2860
    },
    {
      "path": "v8-full-source/tables/V8-T004.md",
      "sha256": "8d2c4a6d6c0627f96df2322dd2585f0a86e42151eabcd3e228ee0a10345688c9",
      "size": 2670
    },
    {
      "path": "v8-full-source/tables/V8-T005.md",
      "sha256": "d978278ae08b1f17441eb67dcbffa8831f9cd49f4b1d94f83f36b0115c61e49b",
      "size": 7739
    },
    {
      "path": "v8-full-source/tables/V8-T006.md",
      "sha256": "f3343450f8a62684bead4647b084df9edaeda8b6715b289dd777817b98ae1622",
      "size": 5133
    },
    {
      "path": "v8-full-source/tables/V8-T007.md",
      "sha256": "6d71717e134ee40a46b53aed7fe673672d1ddcccc2421417704c1770fd9bdeab",
      "size": 3785
    },
    {
      "path": "v8-full-source/tables/V8-T008.md",
      "sha256": "bf42bbd2fc68b4cd1724a74f520c553b92573580da1f01c259fb0e7581578243",
      "size": 5641
    },
    {
      "path": "v8-full-source/tables/V8-T009.md",
      "sha256": "b5e6498b8d11a1e399e21f796aa51abae71c4f1886e60927d5755b5919159503",
      "size": 4931
    },
    {
      "path": "v8-full-source/tables/V8-T010.md",
      "sha256": "37f923976e8d5c5ab273a825dae38c39802523f15b9e1c97854243c227fc7840",
      "size": 1930
    },
    {
      "path": "v8-full-source/tables/V8-T011.md",
      "sha256": "1ba4dcace1acdb575bf12122f6eb89782257d20738faab2c9a3c9523a1058843",
      "size": 7964
    },
    {
      "path": "v8-full-source/tables/V8-T012.md",
      "sha256": "f24e3cfa60cc9bf3c8cfa2433f843e76c6becadc193649d7efb349634214657b",
      "size": 6496
    },
    {
      "path": "v8-full-source/tables/V8-T013.md",
      "sha256": "ade5b8510639b4387fc5e1312b882a4e89302924bca0ae62091245593b4a5049",
      "size": 4054
    },
    {
      "path": "v8-full-source/tables/V8-T014.md",
      "sha256": "00f7a2f2c898d0e18a46b25b37fa8024cac0a2ced127123a82aa27d5c786f2c6",
      "size": 3370
    },
    {
      "path": "v8-full-source/tables/V8-T015.md",
      "sha256": "b8538c4c262ce3f3ac50985ed2f70fb9e1ba4cd1b13e8bf5a68a3c59e58876e2",
      "size": 2770
    },
    {
      "path": "v8-full-source/tables/V8-T016.md",
      "sha256": "358523095a2af8cef7c721e08fadd279b5b71c03eaf9dc87aaa249104d113e77",
      "size": 6453
    },
    {
      "path": "v8-full-source/tables/V8-T017.md",